id,reporter,contact,category,location,description,severity,status,timestamp
TEST0001,Alice Smith,9876543210,Pothole,123 Elm Street,Large pothole in the middle of the road causing safety concerns for drivers.,High,In Progress,2026-06-30 11:20:00
BA3FC30D,abimanya,9085691343,Streetlight Failure,"5th street , marina beach",few days  our street ligth was not  work  .and our street is  unsafty for nigth time  .already report the community member . he is not take any action.,High,Pending,2026-06-30 12:27:57
D7A7F56C,sharan,9346578901,Water Supply Pipe Leak,"37/3 , ganapthy main street","street pipe liine is break ,so take immiedate action.",High,Pending,2026-06-30 12:34:04
ABCFD9F7,kani,6789999864,Garbage Accumulation,"north street ,peelamedu",ctfdtfygujhjnyusers,Medium,Pending,2026-06-30 12:40:56
D67198C7,sabitha,9087563435,Stray Animals,ytftyuhg65r,dretfyfgy7t67t7uhuihiu,Low,Pending,2026-06-30 12:42:00
